{
  "$schema": "http://json-schema.org/draft-07/schema#",
  "title": "P2 Evidence V8 Schema",
  "type": "object",
  "required": [
    "schema_version", "task_id", "task_family", "status",
    "completion_level", "runtime_mode", "runtime_environment_kind",
    "environment", "implementation",
    "media_input", "extension_input",
    "media_identity", "source_identity", "extension_identity",
    "capability_probe",
    "direct_play_decision", "direct_stream_decision",
    "subtitle_snapshot", "chapter_snapshot", "playback_state_snapshot",
    "inspector_snapshot", "decision_ledger",
    "errors",
    "redaction_verified", "schema_validated",
    "anti_fake_checks", "redline_scan",
    "test_commands", "artifacts",
    "requires_provider_matrix",
    "runtime_verified", "blocked_reason",
    "timestamp_utc"
  ],
  "properties": {
    "schema_version": { "type": "string", "pattern": "^p2-evidence-v8$" },
    "task_id": { "type": "string", "minLength": 1 },
    "task_family": { "type": "string", "minLength": 1 },
    "status": { "type": "string", "enum": ["RUNTIME_PASS","CONTRACT_PASS","FAIL","BLOCKED_ENV","NOT_IMPLEMENTED","SKIPPED_TEST_ONLY"] },
    "completion_level": { "type": "string" },
    "runtime_mode": { "type": "string" },
    "runtime_environment_kind": { "type": "string", "enum": ["local_real_runtime","windows_device_runtime","controlled_real_protocol_server","real_external_service","real_external_account","real_external_device","mock","unit_test","simulator","not_applicable"] },
    "environment": { "type": "object" },
    "implementation": { "type": "object" },
    "media_input": { "type": "object" },
    "extension_input": { "type": "object" },
    "media_identity": { "type": "object" },
    "source_identity": { "type": "object" },
    "extension_identity": { "type": "object" },
    "capability_probe": { "type": "object" },
    "direct_play_decision": { "type": "object" },
    "direct_stream_decision": { "type": "object" },
    "subtitle_snapshot": { "type": "object" },
    "chapter_snapshot": { "type": "object" },
    "playback_state_snapshot": { "type": "object" },
    "inspector_snapshot": { "type": "object" },
    "decision_ledger": { "type": "object" },
    "errors": { "type": "array" },
    "redaction_verified": { "type": "boolean" },
    "schema_validated": { "type": "boolean" },
    "anti_fake_checks": { "type": "object" },
    "redline_scan": { "type": "object" },
    "test_commands": { "type": "array" },
    "artifacts": { "type": "array" },
    "requires_provider_matrix": { "type": "boolean" },
    "runtime_verified": { "type": "boolean" },
    "blocked_reason": { "type": "string" },
    "timestamp_utc": { "type": "string", "format": "date-time" }
  }
}
