{"schema_version":"p2-evidence-v8","task_id":"CLEAN-001","task_family":"clean_runtime_proof","status":"RUNTIME_PASS","completion_level":"p2-local-runtime","runtime_mode":"real_runtime","runtime_environment_kind":"local_real_runtime","environment":{"environment_required":true,"environment_available":true},"implementation":{},"media_input":{"kind":"local_file"},"extension_input":{},"media_identity":{},"source_identity":{},"extension_identity":{},"capability_probe":{},"direct_play_decision":{},"direct_stream_decision":{},"subtitle_snapshot":{},"chapter_snapshot":{},"playback_state_snapshot":{},"inspector_snapshot":{},"decision_ledger":{},"errors":[],"redaction_verified":true,"schema_validated":true,"anti_fake_checks":{},"redline_scan":{},"test_commands":[],"artifacts":[],"requires_provider_matrix":false,"runtime_verified":true,"blocked_reason":"","timestamp_utc":"2026-06-26T00:00:00Z"}
