{
  "schema_version": "p2-evidence-v8",
  "task_id": "SRC-CORE-SKELETON-001",
  "task_family": "source_core",
  "status": "CONTRACT_PASS",
  "completion_level": "p2-foundation-skeleton",
  "runtime_mode": "planning_only",
  "runtime_environment_kind": "not_applicable",
  "environment": {},
  "implementation": {
    "contracts_skeleton_present": true,
    "runtime_skeleton_present": true,
    "provider_runtime_absent": true,
    "contracts_family_count": 9,
    "runtime_family_count": 7,
    "provider_boundary_count": 7,
    "contract_version": 1,
    "source_session_centered_model": true,
    "contracts_dependency_direction_clean": true,
    "runtime_dependency_direction_clean": true,
    "provider_targets_interface_only": true,
    "contract_headers": 12,
    "runtime_headers": 10,
    "test_executables": 16,
    "tests_passed": 16,
    "tests_failed": 0
  },
  "media_input": { "kind": "not_applicable" },
  "extension_input": {},
  "media_identity": {},
  "source_identity": {
    "provider_kinds": 22,
    "contract_implemented": true,
    "uri_three_layer": true,
    "identity_no_raw_input": true
  },
  "extension_identity": {},
  "capability_probe": {},
  "direct_play_decision": {},
  "direct_stream_decision": {},
  "subtitle_snapshot": {},
  "chapter_snapshot": {},
  "playback_state_snapshot": {},
  "inspector_snapshot": {},
  "decision_ledger": {},
  "errors": [],
  "redaction_verified": true,
  "schema_validated": true,
  "anti_fake_checks": {
    "contract_pass_only": true,
    "no_runtime_pass": true,
    "no_provider_runtime": true
  },
  "redline_scan": {},
  "test_commands": [],
  "artifacts": [],
  "requires_provider_matrix": false,
  "runtime_verified": false,
  "blocked_reason": "",
  "timestamp_utc": "2026-06-26T13:13:00Z"
}
